{
  "schema_version": "2.2.0",
  "review_id": "RBE-GSCF001-0004",
  "review_date": "2026-07-26T10:00:00Z",
  "trigger": "Second review: GS-CF001-C re-run with two independent source families",
  "tier": 2,
  "tier_rationale": "Research proof bundle informing a commercial opportunity assessment; data, evidence, commercial and architecture seats required.",
  "artefact_sha": "11ec72b53fca8a5eb0e0e0a2f0a1c8b6d9e4f7a3",
  "repository": "ianmcguane681-netizen/GS-CF001",
  "architecture_authority": "RBE-001 v1.1.0",
  "methodology_profile_id": "RBM-001",
  "methodology_version": "2.2.0",
  "methodology_status": "RELEASE_CANDIDATE",
  "methodology_checksum": "sha256:9d6cd7cf305b3a415d664ec61ebe691e06439591257a2e86617880c39b7f8461",
  "manifest_root_sha256": "sha256:5e4955e2a71f80aeea1aebe1b84bf0fb6bcd8f7ab42db9119fec16df6e8bb117",
  "human_approval_record": null,
  "binding": false,
  "board_chair": "ian.mcguane",
  "methodology_auditor": "agent:ma",
  "sceptical_reviewer": "agent:sr",
  "specialists": {
    "saa": "agent:saa",
    "bca": "agent:bca",
    "dea": "agent:dea",
    "qra": "agent:qra",
    "spa": null,
    "poa": null
  },
  "input_process_status": "READY"
}
